{
  "behavior": {
    "architecture": "bert",
    "graph_file": "onnx/model.onnx",
    "hidden_size": 768,
    "max_tokens": 8192,
    "normalize": "none",
    "output_name": "last_hidden_state",
    "pad_token_id": 0,
    "padding_side": "right",
    "pooling": "mean",
    "prompts": {
      "none": ""
    },
    "tokenizer_file": "tokenizer.json",
    "tokenizer_profile": "bert-wordpiece-uncased",
    "truncation": "longest_first",
    "vocabulary_size": 30522
  },
  "evaluation": {
    "policy": {
      "attention_mask": "exact",
      "embedding_max_abs": 0.00005,
      "hidden_max_abs": 0.001,
      "non_finite": "fail",
      "padded_batch_max_abs": 1e-05,
      "required_paths": [
        "reference",
        "python-onnx",
        "dotnet-ids",
        "dotnet-text"
      ],
      "same_backend_max_abs": 1e-05,
      "score_max_abs": 0.0001,
      "token_ids": "exact",
      "token_type_ids": "exact"
    },
    "status": "proposed"
  },
  "format_version": 1,
  "id": "nomic-embed-text-v1.5/onnx-fp32-cpu",
  "origin": {
    "files": [
      {
        "path": "1_Pooling/config.json",
        "sha256": "3d6180f7233df2f529d65ea60c8db4af614fb78cbe99fd81103dcfeb9f8166a5",
        "size": 286
      },
      {
        "path": "README.md",
        "sha256": "4430178908fbd574fdb6457e302d23e643d733ed036b5777180b0806946767b2",
        "size": 71843
      },
      {
        "path": "config.json",
        "sha256": "9ab00bd92cee80a569f708140b7b6c1661a65891ff3765b1519e181ba2f2c92b",
        "size": 2538
      },
      {
        "path": "config_sentence_transformers.json",
        "sha256": "482f42ca954f5a8d55bccbb437b8d6eb721ce19059c78330c815045ddd1a87eb",
        "size": 140
      },
      {
        "path": "model.safetensors",
        "sha256": "9e7d262b1fe5ea350782829496efa831901b77486bbde1cea54a4c822d010d5c",
        "size": 546938168
      },
      {
        "path": "modules.json",
        "sha256": "f93c503b32fa7bc2e186843f0add961caa14eb68f7be516e327df3cadbcd541a",
        "size": 255
      },
      {
        "path": "onnx/model.onnx",
        "sha256": "147d5aa88c2101237358e17796cf3a227cead1ec304ec34b465bb08e9d952965",
        "size": 547310275
      },
      {
        "path": "sentence_bert_config.json",
        "sha256": "9ee3935137f87c9ce6662ae17fe7afb7c9c64744a41247359fd228dc37e627b3",
        "size": 58
      },
      {
        "path": "special_tokens_map.json",
        "sha256": "5d5b662e421ea9fac075174bb0688ee0d9431699900b90662acd44b2a350503a",
        "size": 695
      },
      {
        "path": "tokenizer.json",
        "sha256": "d241a60d5e8f04cc1b2b3e9ef7a4921b27bf526d9f6050ab90f9267a1f9e5c66",
        "size": 711396
      },
      {
        "path": "tokenizer_config.json",
        "sha256": "d7e0000bcc80134debd2222220427e6bf5fa20a669f40a0d0d1409cc18e0a9bc",
        "size": 1191
      },
      {
        "path": "vocab.txt",
        "sha256": "07eced375cec144d27c900241f3e339478dec958f92fddbc551f295c992038a3",
        "size": 231508
      }
    ],
    "repo": "nomic-ai/nomic-embed-text-v1.5",
    "revision": "e9b6763023c676ca8431644204f50c2b100d9aab"
  },
  "runtime": {
    "backend": "onnx",
    "precision": "fp32",
    "provider": "CPUExecutionProvider",
    "version": "1.30.0"
  },
  "task": "embeddings"
}
