{
  "behavior": {
    "architecture": "Qwen3ForCausalLM",
    "cache": "fresh-request; cached-vs-uncached reference verified",
    "enable_thinking_default": false,
    "endoftext_token_id": 151643,
    "eos_token_ids": [
      151643,
      151645
    ],
    "im_end_token_id": 151645,
    "im_start_token_id": 151644,
    "max_new_tokens": 16,
    "model_type": "qwen3",
    "multimodal": "unsupported",
    "pad_overlay_reason": "unused embedding row; preserve literal <|endoftext|> prompt attention",
    "pad_token_id_overlay": 151935,
    "template": "qwen3-text-v1",
    "tools": "unsupported",
    "vocab_size": 151936
  },
  "evaluation": {
    "policy": {
      "greedy_ids": "exact",
      "logits_max_abs": 0.005,
      "logits_mean_abs": 0.0005,
      "prompt_ids": "exact",
      "required_evidence": [
        "prompt_text",
        "prompt_ids",
        "initial_logits",
        "output_ids",
        "finish_reason",
        "stream",
        "usage",
        "cancellation",
        "cache",
        "isolation"
      ]
    },
    "status": "proposed"
  },
  "format_version": 1,
  "id": "qwen3-0.6b/ortgenai-fp32-cpu",
  "origin": {
    "files": [
      {
        "path": "LICENSE",
        "sha256": "832dd9e00a68dd83b3c3fb9f5588dad7dcf337a0db50f7d9483f310cd292e92e",
        "size": 11343
      },
      {
        "path": "README.md",
        "sha256": "1ab64a26fcb3b461423b89a433a8c858f1bf8d4086f979cbb3ff878d47cf20e9",
        "size": 13965
      },
      {
        "path": "config.json",
        "sha256": "660db3b73d788119c04535e48cf9be5f55bc3100841a718637ae695b442f27dd",
        "size": 726
      },
      {
        "path": "generation_config.json",
        "sha256": "2325da0f15bb848e018c5ae071b7943332e9f871d6b60e2ed22ca97d4cb993d2",
        "size": 239
      },
      {
        "path": "merges.txt",
        "sha256": "8831e4f1a044471340f7c0a83d7bd71306a5b867e95fd870f74d0c5308a904d5",
        "size": 1671853
      },
      {
        "path": "model.safetensors",
        "sha256": "f47f71177f32bcd101b7573ec9171e6a57f4f4d31148d38e382306f42996874b",
        "size": 1503300328
      },
      {
        "path": "tokenizer.json",
        "sha256": "aeb13307a71acd8fe81861d94ad54ab689df773318809eed3cbe794b4492dae4",
        "size": 11422654
      },
      {
        "path": "tokenizer_config.json",
        "sha256": "d5d09f07b48c3086c508b30d1c9114bd1189145b74e982a265350c923acd8101",
        "size": 9732
      },
      {
        "path": "vocab.json",
        "sha256": "ca10d7e9fb3ed18575dd1e277a2579c16d108e32f27439684afa0e10b1440910",
        "size": 2776833
      }
    ],
    "repo": "Qwen/Qwen3-0.6B",
    "revision": "c1899de289a04d12100db370d81485cdf75e47ca"
  },
  "runtime": {
    "backend": "ortgenai",
    "precision": "fp32",
    "provider": "CPUExecutionProvider",
    "version": "0.17.1"
  },
  "task": "generation"
}
